{
  "$schema": "https://json-schema.org/draft/2020-12/schema",
  "$id": "https://neworder.dev/schemas/political-system.schema.json",
  "title": "Political System Profile",
  "description": "JSON Schema for political system profiles (DR-144). Defines how a government functions and its gameplay-impacting modifiers.",
  "type": "object",
  "required": [
    "schemaVersion",
    "systemId",
    "systemName",
    "description",
    "decisionSpeedModifier",
    "stabilityBaseline",
    "civilLibertyIndex",
    "pressFreedomIndex",
    "corruptionBaseline",
    "successionRisk",
    "reformCapacity"
  ],
  "additionalProperties": false,
  "properties": {
    "schemaVersion": {
      "type": "string",
      "const": "1.0.0"
    },
    "systemId": {
      "type": "string",
      "pattern": "^[a-z][a-z0-9-]*$",
      "minLength": 2,
      "maxLength": 50,
      "description": "Unique identifier (e.g., 'liberal-democracy', 'military-junta')"
    },
    "systemName": {
      "type": "string",
      "minLength": 1,
      "maxLength": 100,
      "description": "Human-readable name"
    },
    "description": {
      "type": "string",
      "minLength": 10,
      "description": "Detailed description of how this government type operates"
    },
    "decisionSpeedModifier": {
      "type": "number",
      "minimum": -30,
      "maximum": 50,
      "description": "% modifier to action processing speed. Positive = faster decisions. Autocracies high, democracies low."
    },
    "stabilityBaseline": {
      "type": "number",
      "minimum": -20,
      "maximum": 20,
      "description": "Baseline stability adjustment. Positive = more stable initial conditions."
    },
    "civilLibertyIndex": {
      "type": "number",
      "minimum": 0,
      "maximum": 100,
      "description": "Level of individual freedoms (0 = totalitarian, 100 = full liberty)"
    },
    "pressFreedomIndex": {
      "type": "number",
      "minimum": 0,
      "maximum": 100,
      "description": "Media freedom level (0 = total state control, 100 = fully free press)"
    },
    "corruptionBaseline": {
      "type": "number",
      "minimum": 0,
      "maximum": 100,
      "description": "Base corruption level (0 = transparent, 100 = pervasively corrupt)"
    },
    "successionRisk": {
      "type": "number",
      "minimum": 0,
      "maximum": 100,
      "description": "Risk of instability during leadership transitions (0 = smooth, 100 = crisis-prone)"
    },
    "reformCapacity": {
      "type": "number",
      "minimum": 0,
      "maximum": 100,
      "description": "Ability to enact reforms and adapt to changing conditions"
    },
    "gameplayModifiers": {
      "type": "object",
      "description": "Additional gameplay effect modifiers",
      "properties": {
        "stabilityRecoveryRate": {
          "type": "number",
          "description": "Modifier to stability recovery speed per turn"
        },
        "crisisResistance": {
          "type": "number",
          "description": "Stability threshold modifier before crisis triggers"
        },
        "intelligenceModifier": {
          "type": "object",
          "properties": {
            "counterIntel": { "type": "number" },
            "humintAbroad": { "type": "number" }
          }
        },
        "controversialActionDelay": {
          "type": "integer",
          "minimum": 0,
          "maximum": 3,
          "description": "Turns of delay for controversial actions (war declarations, emergency powers)"
        },
        "propagandaEffectiveness": {
          "type": "number",
          "description": "Modifier to domestic propaganda/narrative effectiveness"
        },
        "civilUnrestThreshold": {
          "type": "number",
          "description": "Modifier to civil unrest escalation thresholds"
        }
      }
    },
    "tags": {
      "type": "array",
      "items": { "type": "string" },
      "description": "Categorization tags"
    }
  }
}
